{
  "kind": "LawfulMetadataHarvestRunArtifact",
  "artifact_id": "lmh_run_artifact_20260611_001",
  "run_ref": "agentplane://run/lawful-metadata-harvest-smoke/run_20260611_001",
  "harvest_batches": [
    {
      "batch_id": "batch_001_identify",
      "verb": "Identify",
      "records_harvested": 1,
      "records_valid": 1,
      "batch_status": "complete",
      "resumption_token": null,
      "evidence_ref": "evidence://agentplane/lmh/batch_001_identify"
    },
    {
      "batch_id": "batch_002_list_records",
      "verb": "ListRecords",
      "records_harvested": 50,
      "records_valid": 48,
      "batch_status": "complete",
      "resumption_token": null,
      "evidence_ref": "evidence://agentplane/lmh/batch_002_list_records"
    },
    {
      "batch_id": "batch_003_list_records_page2",
      "verb": "ListRecords",
      "records_harvested": 22,
      "records_valid": 22,
      "batch_status": "complete",
      "resumption_token": null,
      "evidence_ref": "evidence://agentplane/lmh/batch_003_list_records_page2"
    }
  ],
  "envelope_ref": "procybernetica://lawful-metadata-harvest-envelope/lmh_20260611_001",
  "replay_ref": "agentplane://replay/lawful-metadata-harvest-smoke/replay_20260611_001",
  "promotion_decision": {
    "decision": "defer",
    "decided_by": "agentplane/lawful-harvest-promotion-gate",
    "promotion_is_explicit": true,
    "reason": "Awaiting ProCybernetica validator confirmation before promotion"
  },
  "token_loop_anomaly": {
    "detected": false,
    "anomaly_type": "none",
    "affected_batch_ids": []
  },
  "no_live_network_harvest": true,
  "policy_ref": "policy://agentplane/lawful-harvest-smoke-v1",
  "procybernetica_protocol_ref": "procybernetica://protocol/lawful-metadata-harvest-envelope/v1",
  "issued_at": "2026-06-11T10:00:00Z"
}
